{
  "file": "/workspace/videos/youtube_ready/LINCOLN_COMEDY_31240_20260117_204153.mp4",
  "title": "Lincoln Reacts #31240: Weather Continues to Be Weather Des... #Shorts",
  "episode": 31240,
  "style": "deadpan",
  "headline": "Weather Continues to Be Weather Despite Complaints",
  "script": "Weather Continues to Be Weathe happened.\n            \n            Everyone's upset.\n            \n            I was already upset so this changes nothing.\n            \n            It's like being double-parked in hell.\n            \n            The second violation doesn't make it worse.\n            \n            You're already in hell.\n            \n            Bitcoin below.\n            \n            It's not hell but it's trying.",
  "description": "Weather Continues to Be Weathe happened.\n            \n            Everyone's upset.\n            \n            I was already upset so this changes nothing.\n            \n            It's like being double-parked in hell.\n            \n            The second violation doesn't make it worse.\n            \n            You're already in hell.\n            \n            Bitcoin below.\n            \n            It's not hell but it's trying.\n\n\ud83c\udfad ABRAHAM LINCOLN COMEDY - Episode #31240\nComedy Style: Deadpan\nTopic: Weather Continues to Be Weather Despite Complaints\n\nThis video uses our NEW COMEDY SYSTEM with actually funny scripts!\nNo more tired roast formulas - just genuine humor in multiple styles.\n\nBitcoin: bc1qaeylk80cz3cd9ckxlyuedyq9eupeqhaujk2plt\n\n#comedy #shorts #lincolnreacts #funny #deadpan #abrahamlincoln #satire #humor #comedyshorts #viral",
  "tags": [
    "comedy",
    "shorts",
    "lincolnreacts",
    "funny",
    "deadpan",
    "abrahamlincoln",
    "satire",
    "humor",
    "comedyshorts",
    "viral",
    "trending",
    "youtube",
    "youtubeshorts",
    "funnymemes"
  ],
  "category": "Comedy",
  "timestamp": "20260117_204153",
  "duration_seconds": 18
}